{
  "api_version": "alred/v1",
  "kind": "OverlayVniMapDiff",
  "metadata": {
    "change_id": "CHG-2026-00123",
    "before_phase": "before",
    "after_phase": "after",
    "generated_at": "2026-08-16T10:15:00+09:00",
    "generator_version": "1.1"
  },
  "summary": {
    "total_changes": 52,
    "added": 52,
    "removed": 0,
    "modified": 0,
    "conflict": 0,
    "unknown": 0
  },
  "changes": [
    {
      "change_type": "ADDED",
      "resource_type": "L2VNI",
      "vni": 10100,
      "vrf": "tenant1-vpc1",
      "device": "adc-lfsw0101",
      "field": "nve_member",
      "before": null,
      "after": true,
      "status": "OBSERVED",
      "evidence_before": [
        {
          "command": "show running-config",
          "file": "synthetic/before/adc-lfsw0101/running_config.txt",
          "sha256": "eb43a542c4b6a1aaed1e82b9e56f3902f959d9acb845494a01593112caf8304f",
          "parse_status": "parsed",
          "status": "success",
          "source_id": "running_config"
        },
        {
          "command": "show nve vni",
          "file": "synthetic/before/adc-lfsw0101/nve_vni.txt",
          "sha256": "d5153f92df841522d362171565f86198905945f2dbd7804600eb1bef90098d49",
          "parse_status": "parsed",
          "status": "success",
          "source_id": "nve_vni"
        }
      ],
      "evidence_after": [
        {
          "command": "show running-config",
          "file": "synthetic/after/adc-lfsw0101/running_config.txt",
          "sha256": "d5123dbb96f47cec60ef330f5348c7d49826b29077a5dcf04748606ddf6e21d6",
          "parse_status": "parsed",
          "status": "success",
          "source_id": "running_config"
        },
        {
          "command": "show nve vni",
          "file": "synthetic/after/adc-lfsw0101/nve_vni.txt",
          "sha256": "12088e5e46a8494f956f38a665ad26c413d899f0a7864e01602b3256f3aa67cc",
          "parse_status": "parsed",
          "status": "success",
          "source_id": "nve_vni"
        }
      ]
    },
    {
      "change_type": "ADDED",
      "resource_type": "L2VNI",
      "vni": 10100,
      "vrf": "tenant1-vpc1",
      "device": "adc-lfsw0101",
      "field": "operational_state",
      "before": null,
      "after": "Up",
      "status": "OBSERVED",
      "evidence_before": [
        {
          "command": "show running-config",
          "file": "synthetic/before/adc-lfsw0101/running_config.txt",
          "sha256": "eb43a542c4b6a1aaed1e82b9e56f3902f959d9acb845494a01593112caf8304f",
          "parse_status": "parsed",
          "status": "success",
          "source_id": "running_config"
        },
        {
          "command": "show nve vni",
          "file": "synthetic/before/adc-lfsw0101/nve_vni.txt",
          "sha256": "d5153f92df841522d362171565f86198905945f2dbd7804600eb1bef90098d49",
          "parse_status": "parsed",
          "status": "success",
          "source_id": "nve_vni"
        }
      ],
      "evidence_after": [
        {
          "command": "show running-config",
          "file": "synthetic/after/adc-lfsw0101/running_config.txt",
          "sha256": "d5123dbb96f47cec60ef330f5348c7d49826b29077a5dcf04748606ddf6e21d6",
          "parse_status": "parsed",
          "status": "success",
          "source_id": "running_config"
        },
        {
          "command": "show nve vni",
          "file": "synthetic/after/adc-lfsw0101/nve_vni.txt",
          "sha256": "12088e5e46a8494f956f38a665ad26c413d899f0a7864e01602b3256f3aa67cc",
          "parse_status": "parsed",
          "status": "success",
          "source_id": "nve_vni"
        }
      ]
    },
    {
      "change_type": "ADDED",
      "resource_type": "L2VNI",
      "vni": 10100,
      "vrf": "tenant1-vpc1",
      "device": "adc-lfsw0101",
      "field": "replication",
      "before": null,
      "after": "UnicastBGP",
      "status": "OBSERVED",
      "evidence_before": [
        {
          "command": "show running-config",
          "file": "synthetic/before/adc-lfsw0101/running_config.txt",
          "sha256": "eb43a542c4b6a1aaed1e82b9e56f3902f959d9acb845494a01593112caf8304f",
          "parse_status": "parsed",
          "status": "success",
          "source_id": "running_config"
        },
        {
          "command": "show nve vni",
          "file": "synthetic/before/adc-lfsw0101/nve_vni.txt",
          "sha256": "d5153f92df841522d362171565f86198905945f2dbd7804600eb1bef90098d49",
          "parse_status": "parsed",
          "status": "success",
          "source_id": "nve_vni"
        }
      ],
      "evidence_after": [
        {
          "command": "show running-config",
          "file": "synthetic/after/adc-lfsw0101/running_config.txt",
          "sha256": "d5123dbb96f47cec60ef330f5348c7d49826b29077a5dcf04748606ddf6e21d6",
          "parse_status": "parsed",
          "status": "success",
          "source_id": "running_config"
        },
        {
          "command": "show nve vni",
          "file": "synthetic/after/adc-lfsw0101/nve_vni.txt",
          "sha256": "12088e5e46a8494f956f38a665ad26c413d899f0a7864e01602b3256f3aa67cc",
          "parse_status": "parsed",
          "status": "success",
          "source_id": "nve_vni"
        }
      ]
    },
    {
      "change_type": "ADDED",
      "resource_type": "L2VNI",
      "vni": 10100,
      "vrf": "tenant1-vpc1",
      "device": "adc-lfsw0101",
      "field": "svi.admin_enabled",
      "before": null,
      "after": true,
      "status": "OBSERVED",
      "evidence_before": [
        {
          "command": "show running-config",
          "file": "synthetic/before/adc-lfsw0101/running_config.txt",
          "sha256": "eb43a542c4b6a1aaed1e82b9e56f3902f959d9acb845494a01593112caf8304f",
          "parse_status": "parsed",
          "status": "success",
          "source_id": "running_config"
        },
        {
          "command": "show nve vni",
          "file": "synthetic/before/adc-lfsw0101/nve_vni.txt",
          "sha256": "d5153f92df841522d362171565f86198905945f2dbd7804600eb1bef90098d49",
          "parse_status": "parsed",
          "status": "success",
          "source_id": "nve_vni"
        }
      ],
      "evidence_after": [
        {
          "command": "show running-config",
          "file": "synthetic/after/adc-lfsw0101/running_config.txt",
          "sha256": "d5123dbb96f47cec60ef330f5348c7d49826b29077a5dcf04748606ddf6e21d6",
          "parse_status": "parsed",
          "status": "success",
          "source_id": "running_config"
        },
        {
          "command": "show nve vni",
          "file": "synthetic/after/adc-lfsw0101/nve_vni.txt",
          "sha256": "12088e5e46a8494f956f38a665ad26c413d899f0a7864e01602b3256f3aa67cc",
          "parse_status": "parsed",
          "status": "success",
          "source_id": "nve_vni"
        }
      ]
    },
    {
      "change_type": "ADDED",
      "resource_type": "L2VNI",
      "vni": 10100,
      "vrf": "tenant1-vpc1",
      "device": "adc-lfsw0101",
      "field": "svi.anycast_gateway",
      "before": null,
      "after": true,
      "status": "OBSERVED",
      "evidence_before": [
        {
          "command": "show running-config",
          "file": "synthetic/before/adc-lfsw0101/running_config.txt",
          "sha256": "eb43a542c4b6a1aaed1e82b9e56f3902f959d9acb845494a01593112caf8304f",
          "parse_status": "parsed",
          "status": "success",
          "source_id": "running_config"
        },
        {
          "command": "show nve vni",
          "file": "synthetic/before/adc-lfsw0101/nve_vni.txt",
          "sha256": "d5153f92df841522d362171565f86198905945f2dbd7804600eb1bef90098d49",
          "parse_status": "parsed",
          "status": "success",
          "source_id": "nve_vni"
        }
      ],
      "evidence_after": [
        {
          "command": "show running-config",
          "file": "synthetic/after/adc-lfsw0101/running_config.txt",
          "sha256": "d5123dbb96f47cec60ef330f5348c7d49826b29077a5dcf04748606ddf6e21d6",
          "parse_status": "parsed",
          "status": "success",
          "source_id": "running_config"
        },
        {
          "command": "show nve vni",
          "file": "synthetic/after/adc-lfsw0101/nve_vni.txt",
          "sha256": "12088e5e46a8494f956f38a665ad26c413d899f0a7864e01602b3256f3aa67cc",
          "parse_status": "parsed",
          "status": "success",
          "source_id": "nve_vni"
        }
      ]
    },
    {
      "change_type": "ADDED",
      "resource_type": "L2VNI",
      "vni": 10100,
      "vrf": "tenant1-vpc1",
      "device": "adc-lfsw0101",
      "field": "svi.ipv4_addresses",
      "before": null,
      "after": [
        "172.16.0.254/24"
      ],
      "status": "OBSERVED",
      "evidence_before": [
        {
          "command": "show running-config",
          "file": "synthetic/before/adc-lfsw0101/running_config.txt",
          "sha256": "eb43a542c4b6a1aaed1e82b9e56f3902f959d9acb845494a01593112caf8304f",
          "parse_status": "parsed",
          "status": "success",
          "source_id": "running_config"
        },
        {
          "command": "show nve vni",
          "file": "synthetic/before/adc-lfsw0101/nve_vni.txt",
          "sha256": "d5153f92df841522d362171565f86198905945f2dbd7804600eb1bef90098d49",
          "parse_status": "parsed",
          "status": "success",
          "source_id": "nve_vni"
        }
      ],
      "evidence_after": [
        {
          "command": "show running-config",
          "file": "synthetic/after/adc-lfsw0101/running_config.txt",
          "sha256": "d5123dbb96f47cec60ef330f5348c7d49826b29077a5dcf04748606ddf6e21d6",
          "parse_status": "parsed",
          "status": "success",
          "source_id": "running_config"
        },
        {
          "command": "show nve vni",
          "file": "synthetic/after/adc-lfsw0101/nve_vni.txt",
          "sha256": "12088e5e46a8494f956f38a665ad26c413d899f0a7864e01602b3256f3aa67cc",
          "parse_status": "parsed",